### ISSUE TITLE
我在一个请求中发生了无法返回并阻塞的问题.

### ISSUE THREAD

**Issue by ahsar** [swlib/saber#32]
代码是这样的

```php
 $chan = new \Swoole\Coroutine\Channel(1);

 go(function () use($chan) {
     $uri     = 'http://10.40.32.1:8800';
     $content = \Swlib\SaberGM::post($uri);
     $chan->push($content);
 });

 $res = [];
 $chanNum = 1;
 while ($chanNum > 0) {
     $item = $chan->pop();
     $res[] = $item;
     $chanNum--;
 }
 print_r($res);
```

但是我通过断点,看到阻塞发生在了
swlib/saber/src/Request.php  $this->client->recv($this->getTimeout()); 这一行代码.

我通过tcpdump 抓包发现 
```txt
17:34:06.867207 IP 4f86ed14dc50.40110 > bogon.8800: Flags [S], seq 623124665, win 29200, options [mss 1460,sackOK,TS val 2069769 ecr 0,nop,wscale 7], length 0
17:34:06.868292 IP bogon.8800 > 4f86ed14dc50.40110: Flags [S.], seq 452901758, ack 623124666, win 65535, options [mss 1460,wscale 2,eol], length 0
17:34:06.868325 IP 4f86ed14dc50.40110 > bogon.8800: Flags [.], ack 1, win 229, length 0
17:34:06.869648 IP 4f86ed14dc50.40110 > bogon.8800: Flags [F.], seq 1, ack 1, win 229, length 0
17:34:06.869798 IP bogon.8800 > 4f86ed14dc50.40110: Flags [.], ack 2, win 65535, length 0
17:34:06.872652 IP bogon.8800 > 4f86ed14dc50.40110: Flags [F.], seq 1, ack 2, win 65535, length 0
17:34:06.872667 IP 4f86ed14dc50.40110 > bogon.8800: Flags [.], ack 2, win 229, length 0
```

在tcp建立连接之后,客户端主动断开连接FIN. 并没有把链接交到应用层http.服务器web server都没有访问日志,这是什么原因呢? 难道是swoole底层问题?

**Comment by twose** [comment]
是否有防火墙，是否有ssl验证

**Comment by ahsar** [comment]
> 是否有防火墙，是否有ssl验证

没有,我把官网的示例替换到我这里也发生了阻塞,目前看来不是swlib/saber类库问题.我已经开始看sw swoole_http_client_coro.cc 代码.
